{"schema_version":"1.0","run_id":"00000000-0000-4000-8000-000000000007","verdict":"passed","track_results":{"infrastructure":{"verdict":"passed","references":["aws-design.json","estimation-infra.json","generation-infra.json","validation-report.json"]},"ai":{"verdict":"passed","references":["ai-workload-profile.json","aws-design-ai.json","estimation-ai.json","generation-ai.json"]}},"checks":{"networking":{"verdict":"passed","references":["aws-design.json","aws-design-ai.json"]},"iam_and_secrets":{"verdict":"passed","references":["generation-infra.json","generation-ai.json"]},"data_flow":{"verdict":"passed","references":["aws-design.json","aws-design-ai.json"]},"observability":{"verdict":"passed","references":["generation-infra.json","generation-ai.json"]},"deployment_order":{"verdict":"passed","references":["generation-infra.json","generation-ai.json"]},"cutover":{"verdict":"passed","references":["generation-infra.json","generation-ai.json"]},"rollback":{"verdict":"passed","references":["generation-infra.json","generation-ai.json"]},"cost_estimate":{"verdict":"passed","references":["estimation-infra.json","estimation-ai.json"]},"validation_dependencies":{"verdict":"passed","references":["validation-report.json","generation-ai.json"]}}}
